
17.05;День рождения Интернета (День утверждения стандарта World Wide Web).  Праздник жареной скорлупы.  День окарин.  дудок и свистелок в своё удовольствие. 
18.05;День рождения майского жжжжука.  Международный день динозавров.  День Розовой Пантеры. 
19.05;День русской печи.  День «Посади что-нибудь».  День парусов на горизонте.  День «Покажите красоту внутреннего мира». 
20.05;Всемирный день пчёл.  День рождения джинсов.  День ветряных вертушек. 
21.05;Международный день чая.  День музы и вдохновения.  Международный день Космоса.  День обмена талисманами. 
22.05;День винегрета.  День рождения тюбика для зубной пасты.  День Шерлока Холмса.  День богатырского Посвиста. 
23.05;Всемирный день черепахи.  Неделя о расслабленном.  Праздник жевальщиков стирательных резинок.  День каштановых свечек. 
24.05;Праздник горилки.  Всемирный день видеоигр.  День валяния в траве. 
25.05;День сотворения мира.  День счастливого билетика.  День полотенца.  Праздник свободы причёсок. 
26.05;Всемирный день рыжих.  День хождения босиком.  Праздник большого напора.  День российского предпринимательства. 
27.05;День смелых решений.  День изобретения шпрот.  Всемирный день товара. 
28.05;День рождения майонеза.  День брюнеток.  День лепестковой вьюги. 
29.05;День табачного дыма.  День гадания на ромашках.  День конца средневековья. 
30.05;День окрошки.  Международный день близнецов.  День жёлтых от одуванчиков носов. 
31.05;День дырок от бублика.  Всемирный день блондинок.  Всемирный день без табака.  Всемирный день попугая. 
01.06;Международный день защиты детей.  Всемирный день родителей.  День отправки рекой бутылки с хорошими мыслями.  День рождения «Супермена». 
02.06;Международный день блудниц.  Праздник падающих шкафов.  Всемирный день бега.  День запуска бумажных змеев и самолётиков. 
03.06;Праздник прогульщика.  Всемирный день велосипеда.  День рождения парашюта.  День «Любовь побеждает всё». 
04.06;День порадования кошачьих богов.  Международный день спойлеров. 
05.06;Праздник солнечных зайчиков.  День резиновых уточек в ванной.  Международный день очистки водоёмов.  День черепашьих гонок. 
06.06;Пушкинский день.  День русского языка.  День рисования драконов.  День рождения электрического утюга. 
07.06;День кувыркальщиков.  День незнакомой кофейни.  День краудфандинга. 
08.06;Всемирный день памяти домашних животных.  День рождения пылесоса.  Всемирный день океанов. 
09.06;Международный день друзей.  День пускания мыльных пузырей. 
10.06;Всемирный день мороженого.  День рождения шариковой ручки.  День разрисованных ладоней.  День поперхальщиков. 
11.06;День неукротимой страсти.  День поиска новой звезды. 
12.06;День гуляния с воздушным шариком.  День пивовара.  Всемирный день джина.  Всемирный день голых велопокатушек. 
13.06;День маленького путешествия.  Праздник куролесов.  День рождения булавки.  День магических кругов. 
14.06;День кофейных зёрен •.  Международный день ванны.  Международный день блогера. 
15.06;Праздник мужских недостатков.  Международный день прогулки.  Всемирный день ветра.  День придумывания новых созвездий. 
16.06;День чекушки.  Международный день морской черепахи.  День отправления в дальнее плавание трёх бумажных корабликов.  День без оранжевой одежды. 
17.06;Всемирный день мусорщика.  Всемирный день крокодила.  День приманивания муз.  День перерыва в работе. 
18.06;Всемирный день гармонии.  Международный день пикника.  Международный день паники.  День поиска четырёхлистного клевера. 
19.06;День спиртоглотов.  День наблюдения за облаками.  Всемирный день неспешной прогулки.  Международный день коробки. 
20.06;Международный день отца.  Всемирный день Wi-Fi.  День невынимающихся пробок.  День новой личности. 
21.06;День солнечных зайчиков.  День летнего солнцестояния.  Международный день цветка.  Международный день медлительности. 
22.06;Праздник лоботрясов.  День воды.  День подмигивания кошкам.  День шоколадного эклера. 
23.06;День без обид.  Иванова ночь.  День тайных посланий.  День рождения пишущей машинки. 
24.06;Праздник чувств.  Международный день феи.  День разноцветных стекол. 
25.06;День улыбок незнакомым людям.  День моряка.  Глобальный день «Битлз».  День «Возьми свою собаку на работу». 
26.06;День прощения.  День рождения зубной щётки.  День теней на стене.  День бармена. 
27.06;День рыболовства.  День рождения банкомата.  День записывания случайных мыслей. 
28.06;День карусельной лошадки.  Международный день пирсинга.  День числа Тау. 
29.06;Праздник объятий.  День поисков кладов и секретов.  День кораблестроителя.  Международный день грязи. 
30.06;Всемирный день социальных сетей.  День разбрасывания монеток.  Международный день астероида. 
01.07;Международный день шутки.  День Куриного Бога.  Международный день куриных крылышек.  День изобретения солнцезащитных очков. 
02.07;Всемирный день собаки.  Праздник трезвенников и язвенников.  День сюрпризов.  Всемирный день НЛО. 
03.07;День тайной дружбы.  Международный день отказа от полиэтиленовых пакетов.  День Достоевского.  Международный день плевания вишнёвыми косточками. 
04.07;День отдыха от праздников.  День отмазывания.  День невидимости. 
05.07;День лужёных глоток.  Всемирный день бикини.  День разноцветных носков с пальцами.  День механического карандаша. 
06.07;Всемирный день поцелуя.  День рождения американского доллара.  День сплетения венков. 
07.07;Иван Купала.  Глобальный день прощения.  День подсчёта камешков на мостовой. 
08.07;День обнаруженных заначек.  День общения со вселенной.  День «Снова стань ребёнком». 
09.07;Всемирный день жареного мяса.  День веры в единорогов.  День моды. 
10.07;Международный день купания нагишом.  День полёта на зонтике.  День Николы Теслы.  День «Не наступите на пчелу». 
11.07;День рыбака.  Всемирный день шоколада.  Целый день соглашения (со вселенной). 
12.07;День фотографа.  День бумажного пакета.  День следования по течению. 
13.07;День рая для дураков.  День поиска за углом.  День довольных сотрудников.  Международный день головоломки. 
14.07;День смородины.  День беспорядка.  Праздник стельки.  День придумывания 27 слов на букву О.
15.07;День русской лени.  День смотрения на фонари.  День рисования углём. 
16.07;День вкусной еды.  День рисования на асфальте.  Всемирный день змеи.  День благодарности морской свинке. 
17.07;День дарения подарков.  Праздник огурца в Суздале.  Всемирный день эмоджи. 
18.07;День идеальной семьи.  День без купальников.  День прогулок под дождём.  День рождения «Тетриса». 
19.07;Праздник клюканий.  День «Обнимите своих детей».  День пирожков с малиновым вареньем. 
20.07;Праздник губошлёпов.  День дневного сна.  Международный день торта.  Международный день шахмат.  День хождения по бордюрам. 
21.07;День или.  День «Пригласите инопланетянина жить с вами». 
22.07;День трудяги.  Всемирный день мозга.  День толстяка и толстушки.  День находок.  День летнего отдыха. 
23.07;День заливной тоски.  Всемирный день китов и дельфинов.  Международный день бла-бла-бла.  День жмурок с ярким светом. 
24.07;Международный день заботы о себе.  День рождения растворимого кофе.  День заглядывания в будущее.  День флориста. 
25.07;День памяти Владимира Высоцкого.  День беспричинности.  День вне Времени.  День поиска новых вкусов и запахов. 
26.07;День парашютиста.  День загадывания загадок. 
27.07;День рождения гамбургера.  День пяти случайных встреч.  День прогулки с домашними растениями.  День ходьбы на ходулях. 
28.07;День загадывания желаний.  День бутылки мира. 
29.07;День спиртоносного дерева.  Международный день тигра.  День поворачивания налево. 
30.07;Международный день дружбы.  День «Поделитесь обнимашками».  День системного администратора.  День цветных напитков. 
31.07;День рождения Гарри Поттера.  День вспоминания любимых книжек. 
01.08;Международный день прощения.  Международная неделя клоунов.  День бумажных салфеток. 
02.08;День сидения на подоконниках.  День рождения почтового ящика. 
03.08;День арбуза.  День поцелуев с зеркалом. 
04.08;День рождения шампанского.  День качания на качелях.  День заветного сундучка. 
05.08;День разглядывания горизонта.  Международный день светофора.  День распрямившегося штопора. 
06.08;Международный день пива.  День огненной воды.  День грибного дождя. 
07.08;День холостяка.  День собирания звёзд.  День тульского пряника.  День замка из песка. 
08.08;Всемирный день кошек.  День рождения холодильника.  День «Счастье случается».  Международный день бесконечности. 
09.08;День воздушных поцелуев.  День книголюбов.  Международный день коворкинга. 
10.08;День попутного ветра.  Всемирный день льва.  День долгих проводов. 
11.08;День «мусорной еды».  День полёта на воздушном шарике.  День кинетического песка. 
12.08;Международный день молодёжи.  Всемирный день слона.  День встреченного рассвета. 
13.08;День встреч.  Международный день левшей.  День шумящих ракушек.  Международный день скептиков. 
14.08;День выгула черепахи.  Праздник воспалённого воображения.  Всемирный день ящерицы.  День сведения татуировки. 
15.08;День памяти Виктора Цоя.  Праздник сладких огурцов.  День рождения телефонного приветствия «Алло».  День шептания с лунными Девами. 
16.08;День малинового варенья.  День Джокера.  День чуда-своими-руками.  День памяти Элвиса Пресли.  Международный день «Помашите в камеру наблюдения». 
17.08;День лысых ёжиков.  День проснувшихся улиток.  День благодарности чёрным котам. 
18.08;Праздник топора.  День смеющихся ангелов.  День общего языка.  Международный день вина «Пино-нуар».  День интуитивной прозорливости. 
19.08;Всемирный день фотографии.  День превращения в бабочку.  День почтовой марки.  Международный день орангутана. 
20.08;Всемирный день лени.  День рождения Чебурашки.  Всемирный день комара.  День музыкальных шкатулок. 
21.08;День без косметики и макияжа.  День поэта.  День сбора диких трав.  Всемирный день медоносных пчёл. 
22.08;День катания по радуге.  День дубовой бочки. 
23.08;День «Обними свою возлюбленную».  День полёта божьих коровок.  День навигации по интернету.  День недорогих авиабилетов.  День «Пари.  как ветер». 
24.08;День рождения картофельных чипсов.  День валяния в стоге сена.  День падающей звезды.  День жажды.  День консервного ножа. 
25.08;День рождения консервной банки.  День лазанья по деревьям.  День рождения операционной системы Linux. 
26.08;День привлечения удачи.  Праздник тринадцатой кошки.  День устраивания секретиков. 
27.08;День первого поцелуя.  Праздник пролетающих облаков.  День мемов.  День ленточек и бубенчиков. 
28.08;День надутых губ.  День запрокидывания головы.  День котлет в Костроме.  Международная ночь летучих мышей.  Всемирный день нарцисса. 
29.08;День рождения мотоцикла.  День гуляний по крышам.  Профессиональный праздник Дедов Морозов.  День бархатных туфелек. 
30.08;Праздник Зубровки.  День рождения электрического пылесоса.  День доставленных посылок.  Международный день китовой акулы. 
31.08;День борьбы с провалами в памяти.  День лошади.  День шёпота травы.  День блога. 
01.09;День рождения осени.  День знаний.  Глобальный день поиска талантов.  Всемирный день написания писем. 
02.09;Всемирный день кокоса.  День свободного ветра в крыльях. 
03.09;Шуфутинов день.  День рождения бюстгальтера.  День открытия новых дверей.  День сорвавшихся с резьбы. 
04.09;World Sexual Health Day.  День оттяга.  Всемирный день бороды.  День незнакомых дорог. 
05.09;Оранжевый день.  День опозданий.  День ухотрепальщиков.  Международный день благотворительности. 
06.09;День полётов над землёй.  День борьбы с прокрастинацией.  День капы для зубов. 
07.09;Праздник барабанщиков.  Международный день чистого воздуха для голубого неба.  День рассказывания историй о летних путешествиях.  Всемирный день уничтожения военной игрушки. 
08.09;День посиделок на кухне.  День финансиста.  Международный день грамотности.  День Бородинского сражения.  День извинений. 
09.09;Международный день красоты.  Всероссийский день лука.  День прекрасного чудака.  День изобретения новых привычек. 
10.09;День разноцветных букетов.  Международный день макияжа.  Всемирный день предотвращения самоубийств.  День «Во всём виноват Большой адронный коллайдер».  День альпака. 
11.09;День рождения гранёного стакана.  Праздник ласкового обращения.  Всероссийский день трезвости (((.  День правильного ожидания необъяснимого. 
12.09;День виртуальной бутылки.  День семейного общения.  День заглядывания в окна.  День джипера.  Всемирный день журавля. 
13.09;День парикмахера.  Международный день шоколада.  День шарлоток и осенних пирогов.  День программиста.  День позитивного мышления.  День «У меня всё под контролём». 
14.09;День слушания шорохов.  Праздник междусобойщиков. 
15.09;День худеющих.  День совпадений снов.  Международный день точки.  День «Когда-нибудь».  День свободных денег. 
16.09;Праздник нелегального пития.  День завитушек.  кудряшек.  локонов.  волют и вензелей.  День Шнобелевской премии. 
17.09;День щекотунчиков.  День разговоров с городом.  День секретаря.  Всемирная акция «Очистим мир».  День «Время вышло». 
18.09;День отмочки хвостов.  Всемирный день чистоты.  День памяти погибших мотоциклистов.  День «Найдите старого друга».  Международный день поедания яблок.  Всемирный день сока. 
19.09;День выгуливания настроения.  День рождения смайлика. 
20.09;День устраивания спонтанных чаепитий.  Всемирный день риса.  День общественнополезного человека. 
21.09;Всемирный день благодарности.  День победы в Куликовской битве.  Международный день мира.  День поиска сказок. 
22.09;День осеннего равноденствия.  Всемирный день без автомобиля.  День раскрашивания серости.  День хоббита.  День сети.  День каракулей. 
23.09;День рождения жевательной резинки.  День чайных драконов.  День образовательных технологий. 
24.09;День незапланированных безумств.  День любовной записки.  Праздник законченности дел.  День «Обними вегетарианца». 
25.09;Всемирный день сновидений.  День тикающих часов.  Международный день кролика.  День математических рассказов. 
26.09;День просящихся рюмок.  День встречи со старыми друзьями.  День рождения граммофона. 
27.09;День дружбана.  День воспитателя и всех дошкольных работников.  День чешского пива.  День подарков миру. 
28.09;День генерального директора.  День рассматривания мелочей.  Международный день права знать. 
29.09;День осеннего одиночества.  Всемирный день сердца.  Всемирный день школьного молока. 
30.09;День мурлыканья и потягивания.  Всемирный день моря.  День улёта.  День Интернета в России (День Рунета). 
01.10;Всемирный день улыбки.  Международный день кофе.  Всемирный день какао и шоколада.  Всемирный день таблицы умножения.  День выдержанного в бочках пива. 
02.10;Всемирный день без алкоголя.  Всемирный день ходьбы.  День путанья следов в осеннем парке.  День рождения электронной почты.  Всемирный день игры. 
