
01.01;Новый год. Международный день похмелья. День памяти былинного Ильи Муромца. День выпускания хлопушек на свободу. 
02.01;Новый мяу-год у кошек. День мягких подушек. День мотивации и вдохновения. День швейцарского сыра. 
03.01;День бенгальских искр и гирляндных огней. День рождения соломинки для коктейлей. День вишни в шоколаде. 
04.01;День пустяков. День спагетти. День страстей по лимонной карамельке. День Ньютона. Всемирный день гипноза. 
05.01;Международный разгрузочный день.  День маленьких историй.  День взбитых сливок. 
06.01;День обнимашек.  День песочного печенья.  Рождественский сочельник.  День яблони. 
07.01;Православное Рождество Христово.  Международный день программистов.  Международный день глупой походки.  День распутывания лыжных следов. 
08.01;День ванны с пеной.  День распространения микробов радости.  День умасливания гремлинов. 
09.01;День игры в прятки с зимой. Международный день хореографа. День путешествия на воздушном шаре.  День игры в Бога. 
10.01;День горького шоколада.  День благодарности комнатным растениям.  День обучения танцам пингвинов.  День своеобразных людей. 
11.01;День «Девочки обнимают мальчиков».  Международный день «Спасибо».  День кофейных грёз.  День тайного приятеля. 
12.01;День поцелуя рыжих.  День похищений.  День посадки внутреннего дерева.  День «Работай усерднее». 
13.01;День осуществления мечты.  Щедрец (Щедрый вечер).  День случайных попутчиков. 
14.01;Старый Новый год.  День поэзии на работе.  День белоснежных птиц.  Праздник осла. 
15.01;День рождения Википедии.  День поиска пропавшего эха.  День музейного селфи.  День бублика. 
16.01;Всемирный день «The Beatles».  День великих сумочных раскопок.  День ничего.  День хорошего подростка. 
17.01;День творчества и вдохновения.  День нарушения обещаний.  День задабривания телефонного божества.  День горячего рома с маслом. 
18.01;День Винни Пуха.  День праздничного ожидания.  День зажигания маяка. 
19.01;Всемирный день снега.  День варки зелья.  День апельсиновых сказок.  День художника вне закона. 
20.01;Удивительный день совпадений.  Зимний день согревания мира.  День пингвина.  День любителей сыра. 
21.01;День объятий.  День остроумных фраз.  День тихих шагов и незаметных взглядов.  Международный день тренировочных штанов. 
22.01;День рождения воздушной кукурузы (День попкорна).  Температурный праздник.  День проветривания блокнотных записей.  День ответов на вопросы вашей кошки. 
23.01;День зелёного света.  Праздник слухов.  День несочетаемых цветов в одежде. 
24.01;День рождения баночного пива.  Международный день эскимо.  Всемирный день смеха от живота.  Международный день образования. 
25.01;Татьянин день (День студентов).  Китайский Новый год.  День счастливых снеговиков. 
26.01;Международный день без интернета.  День случайных направлений. 
27.01;День танца со своей тенью.  День воздушно-пузырчатой упаковки.  Киберпонедельник. 
28.01;День колдунов.  День пробуждения внутреннего ребёнка.  День поп-арта.  День планирования отпуска.
29.01;День необязательств.  День неспешного заплетания кос.  День кукурузных чипсов.  День головоломок. 
30.01;День Деда Мороза и Снегурочки.  День бегства от стресса.  День круассана.  День бессмысленных сообщений на автоответчике. 
31.01;День рождения русской водки.  День ювелира.  День рисования солнца на снегу.  День скотча.  День вдохновения сердца искусством.  День адского холода.  День веселья на работе.  День горячего шоколада.  День наоборот. 
01.02;День Робинзона Крузо.  День «Измените свой пароль».  День заглядывания за спину. 
02.02;День Ы.  День ежа.  День самообновления.  День ездовых собак. 
03.02;Всемирный день борьбы с ненормативной лексикой.  Всемирный день свободной любви.  День волшебства варежек на резинке. 
04.02;Праздник хорошего настроения.  День чудесных чудаков.  День неандертальца. 
05.02;Великий день.  День эрудита.  День разукрашивания планов на будущее.  Всемирный день чтения вслух. 
06.02;Праздник мыслей.  День Боба Марли.  День ступенек и лестниц.  Международный день бармена. 
07.02;День рождения огнетушителя.  День полётов на луну (мыслимых и немыслимых).  День числа Эйлера («e» Day).  День российского бизнес-образования. 
08.02;День предложения руки и сердца.  День подбрасывания монетки.  День мирового кино. 
09.02;День апростохорошо.  День рождения стриптиза.  Международный день пиццы.  Всемирный день брака. 
10.02;День домового (Кудесы).  День памяти А. С. Пушкина.  День рождения утюга.  День рассматривания лиц. 
11.02;День волшебных сказок на ночь.  День рождения парохода.  Проводы наличности.  Международный день женщин и девочек в науке. 
12.02;День безумного желудка.  День прокладывания тропинок.  День Дарвина.
13.02;День подруг.  Всемирный день радио.  День сладких снов.  День бродячих дверей. 
14.02;День cвятого Валентина.  Международный день чудаков-одиночек.  День компьютерщика и программиста.  День маленьких перевоплощений. 
15.02;Всемирный день китов.  День осведомлённости о холостом образе жизни.  День завязывания узелков на счастье.  День звона колец. 
16.02;День свежего ананаса.  Починки.  День поиска запахов. 
17.02;День спонтанного проявления доброты.  День трепета перед Бахусом.  Всемирный день человеческого духа.  День построения воздушных замков. 
18.02;День пельменей.  День.  когда всё понятно без слов.  Праздник всех легкомысленных.  День Плутона. 
19.02;День смешивания разных красок.  Всемирный день защиты морских млекопитающих.  День орнитолога.  Международный день перетягивания каната. 
20.02;День профессионального алкоголика.  День леденцовых петушков.  Всемирный день социальной справедливости.  Международный день курильщиков трубки.
21.02;Праздник жизни.  Всемирный день экскурсовода.  День наблюдения за полётом бумеранга.  День однозадачности. 
22.02;Вселенская родительская суббота.  День приманивания хорошего настроения.  Всемирный день размышлений. 
23.02;День защитника Отечества.  День сражений подушками.  Всемирный день взаимопонимания и мира.  Международный день собачьего печенья. 
24.02;Праздник съехавшей крыши.  День полосок и пятнышек.  Всемирный день бармена.  День рождения лотереи. 
25.02;День открытия спирта.  Международный день блина.  День рождения револьвера.  День составления географических карт несуществующих земель. 
26.02;Международный день неторопливости.  Всемирный день фисташек.  День поиска норы спящего лета.  День стекломойщиков. 
27.02;Международный день оптимиста.  День улыбок глазами.  День Покемона.  День цифрового обучения. 
28.02;День ухода зимы.  День Калевалы. 
01.03;День кошек.  Праздник прихода весны.  Всемирный день комплимента.  День предвкушения тепла. 
02.03;Международный день спички.  День считания ворон.  Всемирный день психического здоровья подростков. 
03.03;День ожидания чуда.  День «Я хочу.  чтобы ты была счастлива».  Всемирный день дикой природы. 
04.03; Международный день очкарика. День апельсиновых котов. День рождения мини-юбки. День выключенных гаджетов.
05.03; Всенародный праздник без названия. День рождения степлера. День пейзажей. нарисованных чаем.
06.03; День Чувака. День возвращения Синей птицы. Всероссийский день гурмана.
07.03; День тёплого одеяла. День прогуливания уроков. День рождения телефонного аппарата. День энергии растений.
08.03;Международный женский день. День весенних крыльев. 
09.03; День выметания скверных мыслей. День нестандартно мыслящих людей. День домашних насекомых. Международный день ди-джея.
10.03; День облачных слонов. Международный день крутизны. День нарушения причинно-следственных связей.
11.03; Праздник голубых слонов. Всемирный день водопровода. День Ромео и Джульетты. День разоблачений.
12.03; День запрета на уныние. Всемирный день ананаса. День компьютерного глюка
13.03; День романтической выпивки. День заглядывания в замочные скважины. День тайского слона.
14.03; День рождения бутерброда. День безобразно хорошего настроения. Международный день числа «Пи»
15.03;День рождения эскалатора.  День мечтания о розовых кустах.  День «Будьте счастливы». 
16.03;День «Ты всё делаешь правильно».  День спонтанности.  День цветных карандашей.  День без селфи. 
17.03;Праздник шёпота.  День подводной лодки. 
18.03;Праздник вещих снов.  День ящиков.  ящичков и коробочек.  День абсолютно невероятных детей. 
19.03;Профессиональный праздник самогонщиков.  Всемирный день сна.  Первый день без шапки.  Международный день клиента. 
20.03;Международный день счастья.  День весеннего равноденствия.  День Земли.  День мартовских зайцев. 
21.03;Международный день лесов.  День песен на крыше.  Всемирный день поэзии. 
22.03;День водкохлёбов.  Международный день таксиста.  День Кап-кап-капели. 
23.03;Праздник мужской солидарности.  День ласкового котёнка.  День «OK» (OK Day).  День одинаковых носков. 
24.03;День вверх тормашками.  День рождения куриного окорочка.  День сноса телебашни.  Международный день достижений. 
25.03;Праздник баламутов.  Международный день вафель.  Закликание Весны (Открытие Сварги).  День приручения воздушных шариков. 
26.03;День одиночества.  Праздник грустных осликов.  День отправки весточки весне на воздушном шарике. 
27.03;Час Земли.  Международный день виски.  Всемирный день театра. 
28.03;День уважения кошки.  День больших перемен.  День рождения стиральной машины.  День «Съешь эскимо». 
29.03;День самопознания.  День скакания на одной ножке.  День бездомного человека.  День фортепиано. 
30.03;День обнимания с солнцем.  День карандаша.  День виртуального отпуска. 
31.03;Международный день декольте.  Международный день «Бросай свою ненавистную работу».  Праздник разноцветных глаз.  День Эйфелевой башни . 
01.04;День коньяка.  День смеха.  День растворимого кофе.  День математика. 
02.04;День апельсиновых сосулек.  День детской йоги.  Международный день проверки фактов. 
03.04;День рождения мобильного телефона.  Всемирный день вечеринки.  День Водяного.  День придумывания хороших примет. 
04.04;Международный день Интернета (День святого Исидора).  Всемирный день крысы (World Rat Day).  Международный день моркови. 
05.04;Международный день супа.  Праздник талой воды.  День звона бубенцов на кошачьих ошейниках. 
06.04;Всемирный день настольного тенниса.  День разноцветных ленточек.  День рождения московского трамвая. 
07.04;День лёгкого пива.  День Подвига.  Международный день бобра.  День рождения Рунета. 
08.04;Праздник куража.  День сброса зимней шкурки.  День рисования птиц. 
09.04;День рождения «веселящего газа».  Всемирный фестиваль овсянки.  День восходящего солнца в шкафной стране. 
10.04;День брата и сестры.  День банана.  День рождения спички.  Глобальный день работы из дома. 
11.04;Всемирный день анимешника.  Праздник неумелых рук.  День добрых дел.  День трёх драконов. 
12.04;День рождения рок-н-ролла.  Международный день полёта человека в космос.  Всемирный день хомяка.  День плетения из солнечных лучей. 
13.04;День рождения троллейбуса.  Всемирный день рок-н-ролла.  День общения с духом безмятежности.  Международный день благодарности растениям. 
14.04;Международный день внезапного смеха.  День «Посмотри на небо».  День Семаргла (Праздник огня).  День «Достигни большего». 
15.04;День путешествий налегке.  Всемирный день искусства.  Международный день культуры. 
16.04;День Чарли Чаплина.  Всемирный день «точки с запятой».  Всемирный день голоса.  День «Спасите слона». 
17.04;Международный день кофе.  День бла-бла-бла.  Весенняя Неделя Добра.  Международный день цирка. 
18.04;День пляски в проснувшемся лесу.  День независимости владельцев домашних животных.  Международный день памятников и исторических мест.  Международный день жонглёров. 
19.04;День велосипеда.  День подснежника.  День путешествующей улыбки.  Праздник читателя этикеток. 
20.04;День поисков смысла жизни.  Национальный день донора крови.  День охоты на королевского кракозябра.  День вилкокрута и ложкочерпия. 
21.04;Международный день пряника.  День главного бухгалтера.  День чемоданов.  День «Iron Maiden». 
22.04;Международный день Матери-Земли.  Праздник мухлёвщиков.  День весенних брудершафтов.  День «Обожаю твои бёдра». 
23.04;День свиданий под луной.  День немецкого пива.  День «Воспользуйся шансом».  Всемирный день книг и авторского права. 
24.04;День рождения газированной воды.  Международный день ветеринарного врача.  Международный день настольных игр.  День витражных сказок. 
25.04;День дочери.  Всемирный день пингвинов.  День бумажных самолётиков.  Международный день ДНК. 
26.04;День «Обними друга».  Международный день варки картофеля.  День вылазок в параллельные миры.  День «Вспомни свой первый поцелуй». 
27.04;День 50-процентной вероятности встречи с динозавром.  День рождения «памперсов».  Всемирный день графического дизайна.
28.04;День «Поцелуй свою вторую половинку».  День работников скорой медицинской помощи.  День молодых и зелёных.  Всемирный день канцтоваров. 
29.04;Всемирный день исполнения Детских Желаний.  Международный день танца.  День загадочных чердаков.  День рождения застёжки-молнии. 
30.04;Вальпургиева ночь.  Международный день джаза.  День веснушчатых созвездий.  Праздник каменной стены. 
01.05;День травы.  День Глобальной Любви.  День заплетающихся ног.  День уличного музыканта. 
02.05;Международный день Гарри Поттера.  Всемирный день веселья.  День лимонада.  День весенних акварелей. 
03.05;Международный день Солнца.  День положительности в уме.  День солнечных пятнашек. 
04.05;День собачьего счастья.  День любителей вермишелевого супа.  День рождения складного зонтика.  Всемирный день дарени. 
05.05;Всемирный день общения.  Международный день принцесс.  Всемирный день математики. 
06.05;Международный день против диеты.  День Даждьбога.  Всемирный день пароля.  День встречи с Белым Рыцарем. 
07.05;День радио.  День распахнутых окон. 
08.05;День рождения напитка «Кока-Кола».  День перешагивания через ступеньку.  Всемирный день осла. 
09.05;Международный день матери.  День Победы в Великой Отечественной войне 1941-1945 годов.  День уличных музыкантов.  День Европы.
10.05;День «Доверяйте своей интуиции».  День девяти жизней.  Всемирный день движения «За здоровье». 
11.05;Праздник желудка.  День «Ешь всё.  что хочешь».  День глаженых шнурков.  День ожидания Мэри Поппинс. 
12.05;День ежиного сопения.  День синдрома хронической усталости.  Всемирный день ориентирования. 
13.05;Всемирный день одуванчика.  День рождения застёжки-липучки.  Всемирный день коктейля. 
14.05;День большого бодуна.  День смешных нелепиц.  Пролетье (Проводы весны). 
15.05;Международный день семьи.  Всемирный день виски.  День «Принесите кому-нибудь цветы».  День калейдоскопов. 
16.05;Праздник подлиз.  Всемирный день выпечки.  День танцев с привидениями.  Международный день света. 
