172,Люди не умеют жить. Их этому не учат.,Коко Шанель
173,"Как ни крути, женщина в жизни мужчины бывает только одна. Все остальные — её тени…",Коко Шанель
174,"Всё в наших руках, поэтому их нельзя опускать.",Коко Шанель
175,"Красота нужна нам, чтобы нас любили мужчины; а глупость — чтобы мы любили мужчин.",Коко Шанель
176,"Никогда не забывайте, что внутри одежды находится женщина.",Коко Шанель
177,Кокетство — это победа разума над чувствами.,Коко Шанель
178,Дефицит настоящих мужчин не повод цепляться за уродов.,Коко Шанель
179,Самый хороший способ испортить отношения — это начать выяснять их.,Уинстон Черчилль
180,"Глуп тот человек, который никогда не меняет своего мнения.",Уинстон Черчилль
181,"Успех — это способность шагать от одной неудачи к другой, не теряя энтузиазма.",Уинстон Черчилль
182,"Не в возрасте дело, а в культуре общения и уровне интеллектуального развития.",Уинстон Черчилль
183,"Успех — это ещё не точка, неудача — это ещё не конец: единственное, что имеет значение, — это мужество продолжать борьбу.",Уинстон Черчилль
184,"— Если бы я была вашей женой, Уинстон, то подсыпала бы вам яд в кофе.",Уинстон Черчилль
185,"— А если бы я был вашим мужем, то выпил бы его.",Уинстон Черчилль
186,"Лучше делать новости, чем рассказывать о них.",Уинстон Черчилль
187,"Когда орлы молчат, болтают попугаи.",Уинстон Черчилль
188,"Школа не имеет ничего общего с образованием. Это институт контроля, где детям прививают основные навыки общежития.",Уинстон Черчилль
189,"Кто со всеми согласен, с тем не согласен никто.",Уинстон Черчилль
190,"Ситуацию мало уметь использовать, её надо уметь создавать.",Уинстон Черчилль
191,"Я извлек из выпивки больше, чем выпивка из меня.",Уинстон Черчилль
192,Заглядывать слишком далеко вперед — недальновидно.,Уинстон Черчилль
193,Своим долголетием я обязан спорту. Я им никогда не занимался.,Уинстон Черчилль
194,"Сокол высоко поднимается, когда летит против ветра, а не по ветру.",Уинстон Черчилль
195,"Если попал в ад, не останавливайся, иди дальше.",Уинстон Черчилль
196,Я — оптимист. Не вижу особой пользы быть чем-то ещё.,Уинстон Черчилль
197,"Кофе – напиток очень личный. Его, как и коньяк, нельзя пить кружками!",Уинстон Черчилль
198,"Затеяв спор настоящего с прошлым, мы обнаружим, что потеряли будущее.",Уинстон Черчилль
199,Умный человек не делает сам все ошибки — он дает шанс и другим.,Уинстон Черчилль
200,"Школьные учителя обладают властью, о которой премьер-министры могут только мечтать.",Уинстон Черчилль
201,"Если одинокое дерево выживает, оно вырастает крепким.",Уинстон Черчилль
202,Я легко удовлетворяюсь наилучшим.,Уинстон Черчилль
203,"За безопасность необходимо платить, а за её отсутствие расплачиваться.",Уинстон Черчилль
204,"Величайший урок жизни в том, что и дураки бывают правы.",Уинстон Черчилль
205,"Я всегда готов учиться, но мне не всегда нравится, когда меня учат.",Уинстон Черчилль
206,Если человек не способен украсть — он не способен на великие свершения.,Уинстон Черчилль
207,"Если ты плачешь не от счастья, то перестань. ",Футурама 
208,"Безумие относительно. Всё зависит от того, кто кого запер в какой клетке.",Рэй Бредбери
209,Непрочитанные книги умеют мстить.,Рэй Бредбери
210,"Человек имеет два мотива поведения — один настоящий и второй, который красиво звучит.",Генри Форд
211,"Каждый, кто перестает учиться, стареет",Генри Форд
212,"Не работодатель выдает зарплату, работодатель только распределяет деньги. Зарплату выдает клиент.",Генри Форд
213,"Качество — это делать что-либо правильно, даже когда никто не смотрит.",Генри Форд
214,"Люди чаще капитулируют, чем терпят крушение.",Генри Форд
215,"Я этого хочу. Значит, это будет.",Генри Форд
216,"Кажется, все искали кратчайшей дороги к деньгам и при этом обходили самую прямую — ту, которая ведет через труд.",Генри Форд
217,"Если ты будешь колоть дрова самостоятельно, то они согреют тебя дважды.",Генри Форд
218,"Бизнес, который не приносит ничего кроме денег, это плохой бизнес.",Генри Форд
219,"Гораздо больше людей сдавшихся, чем побеждённых.",Генри Форд
220,"Гимнастика — это полная чушь. Здоровым она не нужна, а больным противопоказана.",Генри Форд
221,"Не ищите злой умысел там, где все можно объяснить глупостью.",Наполен Бонапарт
222,Вернейший способ сдержать слово — не давать его.,Наполен Бонапарт
223,Дурак имеет великое преимущество перед человеком образованным: он всегда доволен собой.,Наполен Бонапарт
224,Воображение правит миром.,Наполен Бонапарт
225,Чужие глупости никогда не делают нас умными.,Наполен Бонапарт
226,От возвышенного до смешного один только шаг.,Наполен Бонапарт
227,"Вы не выше меня, вы — длиннее.",Наполен Бонапарт
228,"Трон — всего лишь кресло, обитое бархатом.",Наполен Бонапарт
229,Этот день обмену и возврату не подлежит.,Уоррен Баффет 
230,Опасно скрещивать невежество и упорство.,Уоррен Баффет 
231,"Цена — это то, что вы платите. Ценность — это то, что вы получаете.",Уоррен Баффет 
232,"Жизнь слишком коротка, чтобы пить плохие вина.",фон Гёте
233,Где ярче свет — там тени гуще.,фон Гёте
234,Самое смешное желание — это желание нравиться всем.,фон Гёте
235,"Если бы вы знали, как редко нас понимают правильно, вы бы чаще молчали.",фон Гёте
236,"Научиться можно только тому, что любишь.",фон Гёте
237,Поцелуй — это когда две души встречаются между собой кончиками губ.,фон Гёте
238,"Ничего не потеряно, пока не потеряно все.",фон Гёте
239,"Кто хочет много достигнуть, должен ставить высокие требования.",фон Гёте
240,Отличительное свойство человека — желать непременно все начинать сначала.,фон Гёте
241,"Ни в чем не проявляется так характер людей, как в том, что они находят смешным.",фон Гёте
242,"Мы охотнее сознаем свои ошибки в поведении, нежели в мышлении.",фон Гёте
243,Истинное величие начинается с понимания собственного ничтожества.,фон Гёте
244,Юмор — один из элементов гения.,фон Гёте
245,"Идиотов слишком много, людей мало.",фон Гёте
246,"Ненависть — активное чувство недовольства, зависть — пассивное.",фон Гёте
247,"Тот, кто ничего не знает, всему верит.",фон Гёте
248,"Я не создан для этого мира, где стоит только выйти из дому, как попадаешь в сплошное дерьмо.",фон Гёте
249,"То, что не начато сегодня – не закончить завтра.",фон Гёте
250,Нет ничего страшнее деятельного невежества.,фон Гёте
251,"Ничто так не выдает человека, как то, над чем чем он смеётся.",фон Гёте
252,"Молодость больше любит быть поощряемой, нежели обучаемой.",фон Гёте
253,"То, что делает нас счастливым, не может быть названо иллюзией.",фон Гёте
254,"Мы привыкли, что люди издеваются над тем, чего они не понимают.",фон Гёте
255,"Всегда можно найти достаточно времени, если употреблять его хорошо.",фон Гёте
256,"Искусство есть посредник того, чего нельзя высказать.",фон Гёте
257,"Не все, что делает превосходный мастер, сделано превосходно.",фон Гёте
258,"Первое и последнее, требуемое от гения, — это истинность.",фон Гёте
259,"Есть две вещи, которые родители должны дать своим детям: корни и крылья.",фон Гёте
